,DATE,AUTHOR,IMAGE,TEXT,KEYWORDS,SUMMARY
52,14-6-2018,[],"https://static.toiimg.com/thumb/msid-64537164,width-1070,height-580,imgsize-1288336,resizemode-6,overlay-toi_sw,pt-32,y_pad-40/photo.jpg","WASHINGTON DC: HIV vaccine could soon be a reality.Researchers have found that Treg cells, a type of regulatory lymphocyte, might be protecting babies in the womb from getting infected with the HIV virus when the mother is infected.""Finding out what protects the majority of babies is important, as it can lead to ways to boost natural immune responses and make individuals resistant to HIV infection,"" said researcher Peter Kessler from the Emory University School of Medicine.Scientists had been puzzled for years by the fact that only a minority of babies born to mothers with HIV infection get the infection from their mothers.Currently, HIV infection can be successfully managed with antiretroviral drugs, but these drugs have to be given for life. Preventing the infection is very important, but there is no vaccine available yet.Researchers found that levels of Treg lymphocytes were higher in the blood of newborn babies born to mothers with HIV infection who had escaped the infection themselves, compared with babies who were born with HIV infection.Lymphocytes are cells of the immune system that protect the body by fighting bacteria and viruses. Treg cells, or regulatory T cells, are an important ""self-check"" in the immune system to prevent excessive immune reactions that could lead to tissue damage.The researchers examined the blood of 64 babies who were born HIV-uninfected and 28 babies born HIV-infected and found that Treg cell levels were higher in uninfected babies at the time of birth. In contrast, other lymphocyte types were activated and higher in HIV-infected infants. The HIV virus can only infect cells that are activated, so Treg may protect from HIV infection by suppressing activation of other lymphocytes.They analyzed the stored blood by flow cytometry, a technique that can differentiate between the different types of cells based on what markers they express on their surface. Regulatory T cells come in many forms with the most well-understood being those that express the markers CD4, CD25, and FOXP3.""Even though the number of babies studied is relatively small, these findings indicate that Treg, by controlling immune activation, may lower the vulnerability of the babies to HIV or other chronic infections even before they are born,"" said Kessler.These results could pave the way for the development of vaccines or other immune-based therapies that could be used together with medications to prevent the spread of HIV or other infections from mothers to their babies.","['infection', 'immune', 'babies', 'vaccine', 'regulatory', 'comes', 'mothers', 'born', 'important', 'cells', 'treg', 'reality', 'closer', 'hiv']","WASHINGTON DC: HIV vaccine could soon be a reality.Researchers have found that Treg cells, a type of regulatory lymphocyte, might be protecting babies in the womb from getting infected with the HIV virus when the mother is infected.
Preventing the infection is very important, but there is no vaccine available yet.Researchers found that levels of Treg lymphocytes were higher in the blood of newborn babies born to mothers with HIV infection who had escaped the infection themselves, compared with babies who were born with HIV infection.Lymphocytes are cells of the immune system that protect the body by fighting bacteria and viruses.
In contrast, other lymphocyte types were activated and higher in HIV-infected infants.
The HIV virus can only infect cells that are activated, so Treg may protect from HIV infection by suppressing activation of other lymphocytes.They analyzed the stored blood by flow cytometry, a technique that can differentiate between the different types of cells based on what markers they express on their surface.
Regulatory T cells come in many forms with the most well-understood being those that express the markers CD4, CD25, and FOXP3."
53,21-6-2018,['Tamaghna Banerjee'],"https://static.toiimg.com/thumb/msid-64627674,width-1070,height-580,imgsize-1345180,resizemode-6,overlay-toi_sw,pt-32,y_pad-40/photo.jpg","TimesView This is a real sunshine story. Congratulations are in order for the property owners who have risen above such evidently widespread — but completely unfounded — prejudice. We hope the rest of the city learns from this; these kids deserve all our support in their struggle.

KOLKATA: Cafe Positive, a dream of 10 HIV-positive teenagers, has finally found an address.The 12ft-by-10ft garage at Jodhpur Park was finalised after a six-month search for space in some of south Kolkata’s posh localities yielded a straightaway “no” from house-owners when they learnt about who will manage and run the shop.At 524 Jodhpur Park, a senior official of a leading national ayurvedic firm and an honorary member of Rotary Club of Calcutta has offered his garage space to the teenagers from where they plan to start the café in July. “I was initially a bit hesitant to offer my garage space as it is much smaller than what they were looking for. But after learning that they had failed to manage any space in over six months, I told them to start their business from here. This can be the beginning from where they can spread their wings. I am happy to be a part of this noble initiative,” said Indrajyoti Dasgupta.Dasgupta, who has moved his car out of the garage for the café, is yet to find an alternate parking space.TOI had reported on March 5 how six boys and four girls, who have undergone training in baking, sandwich-making and coffee and mocktail preparations, aspired to start their own coffee shop at some location in south Kolkata but were turned down by house-owners.“We faced strange reasons from people for refusing space to these kids. While some said their family members were not ready, others said people in the neighbourhood wouldn’t allow them to run a business with HIV-positive patients. But we are thankful to have finally found space. It is a much smaller space than what we were looking for, but at least the kids can start from here,” said Kallol Ghosh, founder of Anandaghar, a shelter for abandoned HIV/AIDS-infected children at Narendrapur.N GO Anandaghar will give the initial funds and later hand over the management of the café to the 10 youths, who would be running it.The café is scheduled to start from July 14, coinciding with Rath Yatra. “We will begin with an assortment of hot and cold coffees, mocktails and mojitos, and at least four types of cakes, veg and non-veg sandwiches and cookies. For now, we will bank more on takeaway service till we get a bigger place with a larger seating capacity,” said Susanta Pal (name changed), one of the 10 youths.“It has been a long wait. At one time, we thought we would never get space for our shop after being rejected by several house-owners. But now that we have finally managed one, I am happy and looking forward to a better future. We will be able to wipe off the taboos associated with the disease we suffer from with day-to-day interaction with our customers,” said Sathi Biswas (name changed), another member.","['space', 'garage', 'signals', 'finally', 'start', 'dream', 'café', 'teenagers', 'looking', 'smaller', 'househunt', 'south', 'kids', 'end', 'hiv']","Congratulations are in order for the property owners who have risen above such evidently widespread — but completely unfounded — prejudice.
We hope the rest of the city learns from this; these kids deserve all our support in their struggle.
“I was initially a bit hesitant to offer my garage space as it is much smaller than what they were looking for.
But after learning that they had failed to manage any space in over six months, I told them to start their business from here.
But now that we have finally managed one, I am happy and looking forward to a better future."
54,25-6-2018,[],"https://static.toiimg.com/thumb/msid-64692047,width-1070,height-580,imgsize-1208568,resizemode-6,overlay-toi_sw,pt-32,y_pad-40/photo.jpg","JAIPUR: This year Jaipur Municipal Corporation (JMC) will give preference in allotting the dairy booths to the women suffering from HIV+, cancer or a widow. They will be allotted one booth in every ward in the Jaipur city.Chief minister Vasundhara Raje had declared that 5,000 dairy booths will be opened in the state for the women out of which 1,000 will be in Jaipur city. This will be done to empower women and to raise employment opportunities for them.Along with this, there are even plans to open a single window for licensing in the JMC office as the complaints of the public towards the authorities related to the issue of licensing for dairy booths are rising in number.This plan is made to keep a check on the officials so that problem will not be created for the general public. Jaipur city is divided into eight zones and at present in every zone a junior engineer (JEN) look after the matter but after the implementation of single window, soon two JEN and two clerks will look after the matters of four zones each in the office to be allotted in the JMC.Mayor Ashok Lahoti said, “The decision to open a single window is taken to make the licensing scheme more transparent. There is a plan to open 1,000 new dairy booths in the city and new licenses will be given only to the ladies as per the social welfare scheme announced by the chief minister Vasundhara Raje. In all the 91 wards, we have planned to give one dairy booth to the women suffering from AIDS, cancer or is a widow, to help them earn a decent living.”To increase the competition in the state regarding the milk sale JMC has even planned to give 100 booths to the Amul dairy which will also be the company’s first entry in Rajasthan The chairman of the licensing committee Mahesh Kalwani told TOI that the proposal for single window for licensing is made to give proper shape to the plans of chief minister Vasundhara Raje. “I have met many people who have complained about the red tap-ism and corruption that is rampant during the time of license issuing. Even all the applications do not reach us as the officials send applications of those that fulfils their interests and pockets. When the work will start here then we can check for any discrepancies while issuing the order” said that Kalwani.","['window', 'women', 'booths', 'open', 'raje', 'widow', 'licensing', 'single', 'vasundhara', 'jaipur', 'dairy', 'rajasthan', 'hiv']","JAIPUR: This year Jaipur Municipal Corporation (JMC) will give preference in allotting the dairy booths to the women suffering from HIV+, cancer or a widow.
They will be allotted one booth in every ward in the Jaipur city.Chief minister Vasundhara Raje had declared that 5,000 dairy booths will be opened in the state for the women out of which 1,000 will be in Jaipur city.
There is a plan to open 1,000 new dairy booths in the city and new licenses will be given only to the ladies as per the social welfare scheme announced by the chief minister Vasundhara Raje.
Even all the applications do not reach us as the officials send applications of those that fulfils their interests and pockets.
When the work will start here then we can check for any discrepancies while issuing the order” said that Kalwani."
55,14-7-2018,['Sumaiya Yousuf'],https://static.toiimg.com/photo/msid-47529300/47529300.jpg,"BHOPAL: As many as 68 HIV-positive children have got admission in private schools in Madhya Pradesh under RTE — a first for the state and perhaps the country.Officers of the school education department told TOI that they will not reveal the identity of these kids to schools as it was a sensitive issue.In May last year, the Supreme Court had asked all states to include HIV+ kids in disadvantaged category and give them RTE benefits.","['states', 'toi', 'mp', 'school', '68', 'opens', 'supreme', 'told', 'state', 'positive', 'sensitive', 'rte', 'gates', 'kids', 'schools', 'hiv']","BHOPAL: As many as 68 HIV-positive children have got admission in private schools in Madhya Pradesh under RTE — a first for the state and perhaps the country.Officers of the school education department told TOI that they will not reveal the identity of these kids to schools as it was a sensitive issue.In May last year, the Supreme Court had asked all states to include HIV+ kids in disadvantaged category and give them RTE benefits."
56,16-7-2018,[],"https://static.toiimg.com/thumb/msid-64968665,width-1070,height-580,imgsize-139509,resizemode-6,overlay-toi_sw,pt-32,y_pad-40/photo.jpg","MUMBAI: The long-standing demand for a more palatable form of HIV medicine for infants has finally been met with the National Aids Control Organisation (NACO) rolling out oral pellets in its eight nodal paediatric centres across the country, including Sion hospital in Mumbai.Since little over a month, 16 children aged between six months and two years are being given pellets, which look like homeopathy pills, containing drugs lopinavir and ritonavir. The pellets, that can be sprinkled over food too, have already proven to be advantageous, in terms of administration. The syrup , which used to be the main alternative for paediatric patients, was met with a lot of resistance as it left a bitter aftertaste and children would often spit it out.The centre at Sion hospital will be documenting the efficacy and acceptance of the oral pellets, along with the other centres. “So far, the response has been positive. Earlier, parents would return with the syrup bottles and say it was unpalatable,” said Dr Yashwant Gabhale, head of the paediatric centre at Sion. Additionally, a decrease in side-effects has also been seen. “Problems such as nausea, vomiting and diarrhoea have been minimal, so far,” he added.There are nearly 76,000 children living with HIV in the country of which 5,000-odd are from Maharashtra. The use of oral pellets has been restricted to children up to two years of age for now. While the national programme incorporated children since 2006, it was only by late 2007 that paediatric formulations were available. Former paediatric head of Sion hospital Dr Mamata Manglani said that children were initially given adult medication till syrups came into the national programme. “However, there were logistical and storage issues with syrups that paved the way for dispensable tablets over time,” she said.Finding pharmaceutical companies to make child-friendly formulations has always been a challenge, say NACO experts, who hope to scale up once the paediatric centres present their feedback and there are more suppliers. “Currently, Cipla is the only company that is making oral pellet formulation. Mylan is likely to start producing it next,” said NACO’s Dr RS Gupta. He said the introduction of pellets is likely to make a big difference in adherence. “Gulping pills every day is a struggle in itself. It becomes more difficult for babies,” he said. Doctors say the overall adherence among children is more than 90%, till their parents are giving them the medicines.A parent TOI spoke to said oral pellets are undoubtedly easy to administer. “We only hope that it is regularly available and the supply is uninterrupted since there are limited manufacturers,” he said. Not too long ago, the syrup was in short supply across the country.","['hospital', 'say', 'hiv', 'syrup', 'dr', 'pellets', 'paediatric', 'national', 'kids', 'children', 'palatable', 'sion', 'oral']","The pellets, that can be sprinkled over food too, have already proven to be advantageous, in terms of administration.
Earlier, parents would return with the syrup bottles and say it was unpalatable,” said Dr Yashwant Gabhale, head of the paediatric centre at Sion.
The use of oral pellets has been restricted to children up to two years of age for now.
Former paediatric head of Sion hospital Dr Mamata Manglani said that children were initially given adult medication till syrups came into the national programme.
Doctors say the overall adherence among children is more than 90%, till their parents are giving them the medicines.A parent TOI spoke to said oral pellets are undoubtedly easy to administer."
57,18-7-2018,['Tamaghna Banerjee'],"https://static.toiimg.com/thumb/msid-64994202,width-1070,height-580,imgsize-1363574,resizemode-6,overlay-toi_sw,pt-32,y_pad-40/photo.jpg","TimesView Initiatives like this are necessary to dispel perceptions that have no basis in reality. It takes a lot of courage to swim against the tide. We hope this example will prompt more such efforts.

KOLKATA: The dream project of 10 HIV-positive teenagers — that had hit many hurdles, from finding a house to acceptance by locals — finally started brewing from a Jodhpur Park address on Saturday afternoon. Café Positive, an entrepreneurship project by the 10 HIV-positive boys and girls, became operational at a 12 feet by 10 feet garage space at 524 Jodhpur Park in south Kolkata.The youths struggled managing the sudden rush on Day 1at the café that saw a huge acceptance from the Jodhpur Park neighbourhood as people started coming in and congratulating the young owners for their grit, determination and initiative while having café latte or iced tea.“I had read about the youths in the newspapers and empathised with them in their struggle. That they have finally found a place and that too in our neighbourhood feels great. Had I had a place to offer, I would have come forward and helped them long ago,” said Sharmistha Mitra, a resident of a Jodhpur Park apartment and one of the first few customers at the café.TOI had first reported on March 5 how six boys and four girls, who had undergone training in baking, sandwich-making and coffee and mocktail preparations, aspired to start their own coffee shop at some location in south Kolkata but were turned down by house owners.For youths like Sathi Biswas (name changed), Susanta Pal (name changed) and eight others who overcame the hurdles for almost a year, it was a dream come true moment. “We were turned down by so many house owners that at one point of time we had started wondering if we can at all open the café. But we are glad that the day has finally come,” said Biswas, serving Espresso and muffins to two new patrons.Helping them out was Kallol Ghosh, the brain behind the café and the founder of Anandaghar, where the teenagers were brought up. “It’s a day I have been dreaming for long. We had faced strange reasons from people for refusing space to these teenagers. While some said their family members were not ready, others said people in the neighbourhood wouldn’t allow them to run a business with HIV-positive patients. But finally the day has come when the ten have found the platform to break the myths surrounding the disease,” said Ghosh, who runs an NGO, Offer.Actor Parambrata Chatterjee , who was also present at the inauguration, said: “I was disheartened when I came to know that a city like Kolkata was hesitant to give an opportunity to them. Now that they have made it, I am really glad and hope the people turn up in large numbers to taste the delicacies prepared by the youths.”","['park', 'neighbourhood', 'finally', 'come', 'dream', 'café', 'teenagers', 'address', 'started', 'youths', 'starts', 'jodhpur', 'day', 'brewing', 'hiv']","TimesView Initiatives like this are necessary to dispel perceptions that have no basis in reality.
KOLKATA: The dream project of 10 HIV-positive teenagers — that had hit many hurdles, from finding a house to acceptance by locals — finally started brewing from a Jodhpur Park address on Saturday afternoon.
That they have finally found a place and that too in our neighbourhood feels great.
While some said their family members were not ready, others said people in the neighbourhood wouldn’t allow them to run a business with HIV-positive patients.
Now that they have made it, I am really glad and hope the people turn up in large numbers to taste the delicacies prepared by the youths.”"
58,18-7-2018,['Tamaghna Banerjee'],"https://static.toiimg.com/thumb/msid-64994202,width-1070,height-580,imgsize-1363574,resizemode-6,overlay-toi_sw,pt-32,y_pad-40/photo.jpg","TimesView Initiatives like this are necessary to dispel perceptions that have no basis in reality. It takes a lot of courage to swim against the tide. We hope this example will prompt more such efforts.

KOLKATA: The dream project of 10 HIV-positive teenagers — that had hit many hurdles, from finding a house to acceptance by locals — finally started brewing from a Jodhpur Park address on Saturday afternoon. Café Positive, an entrepreneurship project by the 10 HIV-positive boys and girls, became operational at a 12 feet by 10 feet garage space at 524 Jodhpur Park in south Kolkata.The youths struggled managing the sudden rush on Day 1at the café that saw a huge acceptance from the Jodhpur Park neighbourhood as people started coming in and congratulating the young owners for their grit, determination and initiative while having café latte or iced tea.“I had read about the youths in the newspapers and empathised with them in their struggle. That they have finally found a place and that too in our neighbourhood feels great. Had I had a place to offer, I would have come forward and helped them long ago,” said Sharmistha Mitra, a resident of a Jodhpur Park apartment and one of the first few customers at the café.TOI had first reported on March 5 how six boys and four girls, who had undergone training in baking, sandwich-making and coffee and mocktail preparations, aspired to start their own coffee shop at some location in south Kolkata but were turned down by house owners.For youths like Sathi Biswas (name changed), Susanta Pal (name changed) and eight others who overcame the hurdles for almost a year, it was a dream come true moment. “We were turned down by so many house owners that at one point of time we had started wondering if we can at all open the café. But we are glad that the day has finally come,” said Biswas, serving Espresso and muffins to two new patrons.Helping them out was Kallol Ghosh, the brain behind the café and the founder of Anandaghar, where the teenagers were brought up. “It’s a day I have been dreaming for long. We had faced strange reasons from people for refusing space to these teenagers. While some said their family members were not ready, others said people in the neighbourhood wouldn’t allow them to run a business with HIV-positive patients. But finally the day has come when the ten have found the platform to break the myths surrounding the disease,” said Ghosh, who runs an NGO, Offer.Actor Parambrata Chatterjee , who was also present at the inauguration, said: “I was disheartened when I came to know that a city like Kolkata was hesitant to give an opportunity to them. Now that they have made it, I am really glad and hope the people turn up in large numbers to taste the delicacies prepared by the youths.”","['park', 'neighbourhood', 'finally', 'come', 'dream', 'café', 'teenagers', 'address', 'started', 'youths', 'starts', 'jodhpur', 'day', 'brewing', 'hiv']","TimesView Initiatives like this are necessary to dispel perceptions that have no basis in reality.
KOLKATA: The dream project of 10 HIV-positive teenagers — that had hit many hurdles, from finding a house to acceptance by locals — finally started brewing from a Jodhpur Park address on Saturday afternoon.
That they have finally found a place and that too in our neighbourhood feels great.
While some said their family members were not ready, others said people in the neighbourhood wouldn’t allow them to run a business with HIV-positive patients.
Now that they have made it, I am really glad and hope the people turn up in large numbers to taste the delicacies prepared by the youths.”"
