,DATE,AUTHOR,IMAGE,TEXT,KEYWORDS,SUMMARY
71,15-9-2018,['Sumitra Debroy'],"https://static.toiimg.com/thumb/msid-65747051,width-1070,height-580,imgsize-174241,resizemode-6,overlay-toi_sw,pt-32,y_pad-40/photo.jpg","MUMBAI: Four out of 10 HIV-positive newborns in the city could be missing out on timely treatment as their parents fail to return for a confirmatory diagnosis . Failure to detect and treat HIV early may not just cause irreversible neurological damages , but also prove fatal for babies.Doctors at the civic-run BYL Nair Hospital recently discovered the worrying trend while analyzing data of 1,410 babies who were tested for HIV between 2015 and 2018 at the reference laboratory in Kasturba Hospital. At six weeks of birth, infants born to HIV-infected mothers are subjected to the first test, which if positive, is repeated immediately. This second test assumes great significance as the child is immediately started on antiretroviral therapy (ART), if this report too comes positive.The study showed that merely 61% of parents returned for the second confirmatory test. “We were surprised to see that so many parents are missing out on the second visit, thereby delaying the child’s treatment,” said Dr Jayanthi Shastri, who heads the molecular lab at Kasturba that receives samples from 36 HIV testing and counselling centres across the city. The laboratory also gets dried blood spot samples from Gujarat, Goa and Madhya Pradesh. “Such a delay is unfortunate as the advances in ART assure that children with HIV escape the serious neurological damages,” she said.Nair hospital’s Integrated Counselling and Testing Centre has found migration to be one of the biggest reasons. “In 70% of these cases, parents are migrants, who come here for child delivery and return to their hometowns. In a small percentage, it’s also the lack of understanding about the seriousness of HIV,” said Medha Deorukhkar, a counsellor at the centre. Around 46% of children were lost to follow-up, the analysis found.The national protocol warrants that babies be followed up to 18 months as antibodies from mother could give out false positivity in tests carried out before that. In fact, regular follow-ups and counselling are crucial not just for HIV-positive babies, but also for negative ones. While India data is scarce, it has been found that babies who have escaped contracting the virus during birth may still get it through breastfeeding. “Counselling is crucial as mothers may not comprehend the harm of switching between breast milk to formula milk,” said a doctor from Sion hospital’s paediatric centre of excellence for HIV. “Bottle feeds cause ulceration on the gut wall, which makes it conducive for the virus to enter the baby’s bloodstream.”Dr Shikala Acharya, assistant project director at Mumbai District Aids Control Society, said while mother-to-child transmission has dropped to less than 0.2%, tracking remains a challenge. In 2017-18, of around 460 deliveries in HIV-positive women, four babies tested positive. She said in families where the couple has not informed extended family, pursuing them to return for testing of the child becomes difficult.But Dr Anju Seth, director of paediatrics at Delhi’s Lady Hardinge Medical College, said it’s worth the effort as virus suppression is crucial here. “The first three years of a child’s life is when maximum growth happens. If the virus is not controlled, damages like stunting of height, weight and developmental milestones could be permanent.”","['treatment', 'babies', 'test', 'testing', 'counselling', 'study', 'return', 'newborns', 'parents', 'timely', 'second', 'virus', 'miss', 'hivpositive', 'hiv']","MUMBAI: Four out of 10 HIV-positive newborns in the city could be missing out on timely treatment as their parents fail to return for a confirmatory diagnosis .
At six weeks of birth, infants born to HIV-infected mothers are subjected to the first test, which if positive, is repeated immediately.
This second test assumes great significance as the child is immediately started on antiretroviral therapy (ART), if this report too comes positive.The study showed that merely 61% of parents returned for the second confirmatory test.
In a small percentage, it’s also the lack of understanding about the seriousness of HIV,” said Medha Deorukhkar, a counsellor at the centre.
In fact, regular follow-ups and counselling are crucial not just for HIV-positive babies, but also for negative ones."
72,16-9-2018,[],"https://static.toiimg.com/thumb/msid-65764495,width-1070,height-580,imgsize-114819,resizemode-6,overlay-toi_sw,pt-32,y_pad-40/photo.jpg","NEW DELHI: The HIV AIDS (prevention and control) Act 2017 was implementated September 10 onwards, announced the Ministry of Health and Family Welfare on Tuesday.Rajya Sabha passed the bill in March that criminalises discrimination against patients suffering Acquired Immune Deficiency Syndrome (AIDS), a condition caused by Human Immunodeficiency Virus (HIV) , which attacks and weakens the body’s immune system. Here is all you need to know about the act:* The bill is a milestone because it empowers a person living with HIV to report discrimination meted out against them in fields of employment, health care services, educational services, public facilities, property rights, holding public office, and insurance.* The Act penalises ""propagation of hatred"" against the protected person where a violator could be punished with a minimum jail term of three months to a maximum of two years and can be fined up to one lakh rupees.* The Act makes Anti-Retroviral Treatment (ART) a legal right for all HIV/AIDS patients. It has also adopted ""test and treat"" policy which means any person testing positive will be entitled for free treatment by the state and central government. Earlier, this was restricted by a CD4 count rate.* It also provides for confidentiality of HIV-related information and makes it necessary to get informed consent for undertaking HIV tests, medical treatment and research.* The law makes it mandatory for state governments to appoint an Ombudsman to inquire into complaints related to the violation of the Act and the provision of health care services.* If a person or an institution fails to comply with any order given by the Ombudsman within the stipulated period of time, they could be fined a maximum of Rs 10,000. A continuous failure could lead to an additional fine of up to Rs 5000 every day until the they comply.* The new legislation has provisions to safeguard the property rights of HIV positive people. Every HIV infected person below the age of 18 years has the right to reside in a shared household and enjoy the facilities of the household.* The Bill was initially introduced in Parliament by the UPA government, the amendments to the HIV and AIDS (Prevention and Control) Bill, 2014 were revived by the Narendra Modi government in July last year.* The total number of people living with HIV in India is estimated at 21.17 lakhs, whereas around 86000 new HIV infections were reported in 2015, showing 66% decline in new infections from 2000. In 2015 around 68000 people died of AIDS-related causes nationally.","['aids', 'services', 'person', 'treatment', 'act', 'makes', 'need', 'health', 'state', '2017', 'bill', 'know', 'implements', 'ministry', 'hiv']","* The Act makes Anti-Retroviral Treatment (ART) a legal right for all HIV/AIDS patients.
* It also provides for confidentiality of HIV-related information and makes it necessary to get informed consent for undertaking HIV tests, medical treatment and research.
* The law makes it mandatory for state governments to appoint an Ombudsman to inquire into complaints related to the violation of the Act and the provision of health care services.
A continuous failure could lead to an additional fine of up to Rs 5000 every day until the they comply.
Every HIV infected person below the age of 18 years has the right to reside in a shared household and enjoy the facilities of the household."
73,20-9-2018,[],"https://static.toiimg.com/thumb/msid-65816880,width-1070,height-580,imgsize-1222166,resizemode-6,overlay-toi_sw,pt-32,y_pad-40/photo.jpg",Karnataka has third highest number of HIV patients,"['karnataka', 'patients', 'number', 'highest', 'hiv']",Karnataka has third highest number of HIV patients
74,20-9-2018,[],"https://static.toiimg.com/thumb/msid-65816880,width-1070,height-580,imgsize-1222166,resizemode-6,overlay-toi_sw,pt-32,y_pad-40/photo.jpg",'Mission to make India malnutrition-free by 2022 doing well in Meghalaya',"['malnutritionfree', '2022', 'karnataka', 'doing', 'patients', 'number', 'meghalaya', 'india', 'mission', 'highest', 'hiv']",'Mission to make India malnutrition-free by 2022 doing well in Meghalaya'
75,20-9-2018,[],"https://static.toiimg.com/thumb/msid-65816880,width-1070,height-580,imgsize-1222166,resizemode-6,overlay-toi_sw,pt-32,y_pad-40/photo.jpg",Nagaon mill workers turn to President Ram Nath Kovind for help,"['nagaon', 'workers', 'turn', 'kovind', 'help', 'ram', 'karnataka', 'patients', 'nath', 'number', 'highest', 'president', 'hiv']",Nagaon mill workers turn to President Ram Nath Kovind for help
76,20-9-2018,[],"https://static.toiimg.com/thumb/msid-65816880,width-1070,height-580,imgsize-1222166,resizemode-6,overlay-toi_sw,pt-32,y_pad-40/photo.jpg",Mafia money is being used to destabilise my government: CM HD Kumaraswamy,"['destabilise', 'money', 'kumaraswamy', 'mafia', 'hd', 'karnataka', 'cm', 'patients', 'number', 'highest', 'used', 'hiv']",Mafia money is being used to destabilise my government: CM HD Kumaraswamy
77,20-9-2018,['Durgesh Nandan Jha'],"https://static.toiimg.com/thumb/msid-65817740,width-1070,height-580,imgsize-114819,resizemode-6,overlay-toi_sw,pt-32,y_pad-40/photo.jpg","India had around 21.40 lakh people living with HIV/AIDS in 2017, but adult HIV prevalence among 15-49-year-old people has been declining, and was estimated at 0.22% for last year. Also, at 69,000 AIDS-related deaths in 2017, the annual decline is almost 71%. But the declining rates don’t tell the full story as there are several states showing a rising trend. Mizoram had the highest adult HIV prevalence in 2017, followed by Manipur at 1.43% and Nagaland at 1.15%.Maharashtra accounted for 15% of the national total. It was followed by Andhra Pradesh , Karnataka, Telangana, Bengal, Tamil Nadu, UP and Bihar.Around 87,000 new HIV infections were reported in 2017, marking an 85% decline in annual new HIV infections since the peak of 1995. New infections have increased in Arunachal Pradesh, Assam , Mizoram, Meghalaya and Uttarakhand . On the other hand, Bihar, Bengal, Telangana, Delhi, Jharkhand and Haryana had decline rates lower than national average.Telengana topped in new HIV infections with about 9,324 new cases in 2017, which accounted for 11% of total new HIV infections. It is followed by Bihar, Bengal, UP, Andhra Pradesh, Maharashtra, Karnataka and Gujarat . Together these 8 states account for two-thirds of all new annual HIV infections in India.","['states', 'pradesh', 'spread', 'infections', 'bengal', 'progress', 'decline', '2017', 'total', 'telangana', 'followed', 'declining', 'annual', 'hiv']","India had around 21.40 lakh people living with HIV/AIDS in 2017, but adult HIV prevalence among 15-49-year-old people has been declining, and was estimated at 0.22% for last year.
Also, at 69,000 AIDS-related deaths in 2017, the annual decline is almost 71%.
But the declining rates don’t tell the full story as there are several states showing a rising trend.
Mizoram had the highest adult HIV prevalence in 2017, followed by Manipur at 1.43% and Nagaland at 1.15%.Maharashtra accounted for 15% of the national total.
Together these 8 states account for two-thirds of all new annual HIV infections in India."
78,22-9-2018,['Vinod Kumar'],"https://static.toiimg.com/thumb/msid-65836020,width-1070,height-580,imgsize-1115862,resizemode-6,overlay-toi_sw,pt-32,y_pad-40/photo.jpg","CHANDIGARH: In an effort aimed at timely detection of HIV-infected drug addicts through proper screening and testing, the Punjab government has decided to open integrated counselling and testing centres at private drug de-addiction centres . The government plans to set up these under public-private partnership (PPP) mode.As per the data of National Health Profile-2018, which was released recently, there are 26,841 people living with HIV/AIDS (PLHIV). The state has 12 antiretroviral therapy centres where HIV infected people are given treatment. There are around 84 de-addiction centres located in different parts of the states, of which 53 are licensed private centres. While most of the government drug de-addiction centres already have integrated counselling and testing centres, the private centres are functioning without this facility.Dr Manpreet Chhatwal, additional project director of Punjab State Aids Control Society, shared that the integrated counselling and testing centres will be opened in private drug de-addiction centres under PPP mode as defined by the National Aids Control Organisation for screening of HIV patients as well as for hepatitis-C. As per the guidelines framed by the health department, proper screening will be done by the staff posted in these centres for HIV and hepatitis-C by using testing kits, which will be provided by National Aids Control Organisation and National Health Mission.The government will sign an MoU with the private de-addiction centres for which the process will be started by the Punjab State AIDS Control Society. Any person found HIV-positive will be referred to the nearest antiretroviral therapy centres for further treatment and the list will be shared with the nearest government centres by private de-addiction centres every month. Anyone suffering from hepatitis-C will be referred to district civil hospital and government medical colleges for further treatment.In cases where integrated counselling and testing centres are not available in public health institutes, the existing staff, including laboratory technician\staff nurse will be imparted training by the Punjab State Aids Control Society and civil surgeons office for the screening of patients and necessary kits will also made available.Punjab health minister Brahm Mohindra said that timely detection would help in providing the required care and treatment to people infected with HIV and hepatitis-C. “We want to ensure that the facility of counselling and testing centres are available at all drug de-addiction centres,” said Mohindra.","['control', 'health', 'testing', 'drug', 'deaddiction', 'centres', 'counselling', 'state', 'aids', 'private', 'hiv']","CHANDIGARH: In an effort aimed at timely detection of HIV-infected drug addicts through proper screening and testing, the Punjab government has decided to open integrated counselling and testing centres at private drug de-addiction centres .
The state has 12 antiretroviral therapy centres where HIV infected people are given treatment.
There are around 84 de-addiction centres located in different parts of the states, of which 53 are licensed private centres.
While most of the government drug de-addiction centres already have integrated counselling and testing centres, the private centres are functioning without this facility.Dr Manpreet Chhatwal, additional project director of Punjab State Aids Control Society, shared that the integrated counselling and testing centres will be opened in private drug de-addiction centres under PPP mode as defined by the National Aids Control Organisation for screening of HIV patients as well as for hepatitis-C. As per the guidelines framed by the health department, proper screening will be done by the staff posted in these centres for HIV and hepatitis-C by using testing kits, which will be provided by National Aids Control Organisation and National Health Mission.The government will sign an MoU with the private de-addiction centres for which the process will be started by the Punjab State AIDS Control Society.
Any person found HIV-positive will be referred to the nearest antiretroviral therapy centres for further treatment and the list will be shared with the nearest government centres by private de-addiction centres every month."
79,24-9-2018,[],https://static.toiimg.com/photo/msid-65865688/65865688.jpg?72077,"GUWAHATI: The state government is roping in experts from the health and education department to make youths aware of responsible and safe sexual behaviour to check the spread of HIV. India HIV Estimations 2017 show a significant rise in the number of cases in the region in recent years. The government initiative, under the Adolescence Education Programme (AEP), is expected to address this burning issue.The study report- released by the National AIDS Control Organisation (NACO) on Friday-stated Mizoram, with at 2.04% cases, had the highest number of adult HIV cases in the country followed by Manipur at 1.43% and Nagaland at 1.15%. According to the report, new infections in Assam have increased by 37%, while new infections have declined nationally between 2010 and 2017. Among the northeastern states, new infections in 2017 in Arunachal Pradesh increased by 65%, in Assam by 37%, Mizoram by 18% and Meghalaya by 10%.Project director of Assam State AIDS Control Society (ASACS), Anurag Goel, said every selected school should have a male and female teacher for the implementation of the programme. The Centre had launched the initiative in 2005. ""It is our prime responsibility to teach our youth the importance of safe behaviour,"" he said.","['spread', 'programme', 'cases', 'hiv', 'safe', 'state', 'assam', '2017', 'number', 'experts', 'awareness', 'report', 'infections']","GUWAHATI: The state government is roping in experts from the health and education department to make youths aware of responsible and safe sexual behaviour to check the spread of HIV.
India HIV Estimations 2017 show a significant rise in the number of cases in the region in recent years.
According to the report, new infections in Assam have increased by 37%, while new infections have declined nationally between 2010 and 2017.
The Centre had launched the initiative in 2005.
""It is our prime responsibility to teach our youth the importance of safe behaviour,"" he said."
80,3-10-2018,[],"https://static.toiimg.com/thumb/msid-65989221,width-1070,height-580,imgsize-1202111,resizemode-6,overlay-toi_sw,pt-32,y_pad-40/photo.jpg","LUDHIANA: A 22-year-old woman has accused her husband and in-laws of harassment for not bringing enough dowry and also hiding the fact that her husband is HIV positive.The woman came to know about the fact eight months after marriage following which she lodged a police complaint. The woman cell of Ludhiana police, after a year-long inquiry, has booked the man and his father on Wednesday.The woman got married to a Patiala-based professor on January 19, 2017. Her husband did not develop physical relation with her saying that he has some infection. Months later, she found the medical reports of her husband which revealed that he is HIV positive.The woman shared the details with her family who took up the matter with husband and his parents. Meanwhile, the in-laws also started harassing her for not bringing dowry, she alleged.The father of woman said a family in their locality had fixed the match of her daughter. When they questioned them on keeping boy’s medical condition a secret, they threatened the family to keep mum.On August 28, 2017, the family lodged a complaint with the woman cell of Ludhiana police.ASI Sukhdev Singh, investigating officer, woman cell, said police have lodged a case against the accused under Sections 406 (criminal breach of trust), 498-A (dowry harassment) and 420 (cheating and dishonestly inducing delivery of property) of IPC after investigation. The police will arrest the accused soon.","['man', 'woman', 'ludhiana', 'cell', 'secret', 'postive', 'husband', 'hiv', 'family', 'wifes', 'months', 'lodged', 'positivethe', 'dowry', 'accused', 'keeps', 'booked', 'plaint']","The woman cell of Ludhiana police, after a year-long inquiry, has booked the man and his father on Wednesday.The woman got married to a Patiala-based professor on January 19, 2017.
Her husband did not develop physical relation with her saying that he has some infection.
Months later, she found the medical reports of her husband which revealed that he is HIV positive.The woman shared the details with her family who took up the matter with husband and his parents.
Meanwhile, the in-laws also started harassing her for not bringing dowry, she alleged.The father of woman said a family in their locality had fixed the match of her daughter.
The police will arrest the accused soon."
81,5-10-2018,[],https://static.toiimg.com/photo/msid-66013969/66013969.jpg?173643,"PANAJI: In order to challenge HIV and AIDS-related stigma and explore its negative impact on people living with HIV, the Human Touch Foundation, a youth-led organization that works in the field of HIV is organizing a one-minute film competition on HIV stigma. The theme seeks to do away with HIV and AIDS discrimination in terms of self and social acceptance, access to HIV prevention and treatment services, education and employment opportunities as well as many other aspects of everyday life.“HIV and AIDS-related stigma and discrimination refer to negative perceptions and attitudes, misconceptions, prejudice and abuse directed at people living with HIV. Despite the remarkable progress made in advancing HIV science, stigma and discrimination which is founded on the fear surrounding the early AIDS pandemic in the 1980s continues to persist to this day,” says founder, Human Touch Foundation, Peter Borges.The consequences of stigma and discrimination are invariably devastating, he adds, stating that some people are shunned by family, friends, community and society, while others face poor treatment in healthcare and education settings, violation of their human rights , and psychological damage. “These push people living with HIV and key populations further underground, limiting their access to HIV prevention, testing, treatment and other lifesaving health services,” he says.The contest is open to students of higher secondary schools and colleges affiliated to Goa Board and Goa University. The last date to submit the films November 20 by email- getintouch@humantouch.ngo. Richard Williams (M-81975 49909) and Yasin Kalagar (M-78754 04325) can be contacted for details.","['services', 'tackle', 'onemin', 'treatment', 'touch', 'human', 'hivaids', 'films', 'contest', 'discrimination', 'living', 'prevention', 'stigma', 'aims', 'negative', 'hiv']","PANAJI: In order to challenge HIV and AIDS-related stigma and explore its negative impact on people living with HIV, the Human Touch Foundation, a youth-led organization that works in the field of HIV is organizing a one-minute film competition on HIV stigma.
The theme seeks to do away with HIV and AIDS discrimination in terms of self and social acceptance, access to HIV prevention and treatment services, education and employment opportunities as well as many other aspects of everyday life.“HIV and AIDS-related stigma and discrimination refer to negative perceptions and attitudes, misconceptions, prejudice and abuse directed at people living with HIV.
“These push people living with HIV and key populations further underground, limiting their access to HIV prevention, testing, treatment and other lifesaving health services,” he says.The contest is open to students of higher secondary schools and colleges affiliated to Goa Board and Goa University.
The last date to submit the films November 20 by email- getintouch@humantouch.ngo.
Richard Williams (M-81975 49909) and Yasin Kalagar (M-78754 04325) can be contacted for details."
