,DATE,AUTHOR,IMAGE,TEXT,KEYWORDS,SUMMARY
31,20-2-2018,['Shailvee Sharda'],"https://static.toiimg.com/thumb/msid-62976955,width-1070,height-580,imgsize-1353596,resizemode-6,overlay-toi_sw,pt-32,y_pad-40/photo.jpg","UDAI SARAI (Fatehpur): Residents of this small village in Fatehpur district would empathise with HIV-affected Bangarmau town in Unnao the most.More than 12 years ago, their village had hit headlines for reporting a large number of HIV positive cases in a health camp. The incident had lent Udai Sarai a negative image, feel its residents, some of them relieved that the tag is now for Bangarmau’s villages. “Whenever I told people I was from Udai Sarai, they used to quickly check if it was the same HIV village that made news a few years ago. Though I was embarrassed, I had to accept the truth,” said former village head Dhanraj.“The Unnao villages’ incident is unfortunate,” he added, referring to the case where a quack had infected 58 people with a syringe. “But things will change if people determine. Take the case of our village, no new HIV case has been reported in Udai Sarai for a few years. This will help us shun the bad image,” he added.Awareness measures have helped Udai Sarai stay HIV-free for 5 years‘Women spearheading change by discussing prevention’In the detection in 2005, 52 people had tested positive for HIV. Of them, 48 have died while the remaining are on anti-retroviral therapy. The village, barely 18km from a government hospital, was home to around 500 families at that time. At least one member from each was working in Maharashtra or Gujarat. With migrant population believed to be a major reason for the virus, HIV came to be known as ‘Mumbai wali bimari’ here.Today, 90% of the 700 houses in the village have someone working in Maharashtra but no new case has been reported in the past five years.Women have driven the change by openly talking about prevention, claim health activists and officials. Caution has become their second nature.“Women maketheir husbands get themselves tested for HIV at least once a year,” said Vidya Devi, who was a newly wed in 2005. Anganwadi worker Gyan Swaroopa has been a hero of HIV prevention by counselling the women. Breaking barriers of shame and harassment—there is fear of being teased by men for talkingabout sex—she speaks openly to every boy who heads to Mumbai. “Isme kahekisharam... jaan hai to jahan hai (Why be ashamed of doing my duty. Health and survival are the most important),” she reasons.As a result, the air of stigma around HIV is absent in this village.“You can pose direct questions on HIV here unlike in other villages. In fact, HIV testing is considered even at the onset of a simplefever,” saidRajendra Sahu of Nehru Yuva Sangathan Tisi, a social organisation working to create awareness around HIV/ AIDS. Village head Jagatpal said: “The men have been told to have sex only with their wives. The elders keep an eye on the behaviour of their children. Those in Mumbai keep an eye on each other and ensure that no one gets deviated. Medical advice is taken for every disease. Even a simple fever is not ignored and HIV testing is done.”“No HIV positive case has been reported from this village in five years,” said Dr SP Jauhari, secretary of the district aids control society. However, HIV cases in Fatehpur district have continued to rise. Against 97 cases in 2014, 163 cases were reported in 2017. January alone this year has seen 27 cases, data from the health department shows.","['seen', 'udai', 'fresh', 'working', 'villages', 'case', 'bangarmau', 'cases', 'hivaffected', 'fatehpurs', 'health', 'village', 'town', 'reported', 'sarai', 'hiv']","UDAI SARAI (Fatehpur): Residents of this small village in Fatehpur district would empathise with HIV-affected Bangarmau town in Unnao the most.More than 12 years ago, their village had hit headlines for reporting a large number of HIV positive cases in a health camp.
The incident had lent Udai Sarai a negative image, feel its residents, some of them relieved that the tag is now for Bangarmau’s villages.
“Whenever I told people I was from Udai Sarai, they used to quickly check if it was the same HIV village that made news a few years ago.
Take the case of our village, no new HIV case has been reported in Udai Sarai for a few years.
However, HIV cases in Fatehpur district have continued to rise."
32,21-2-2018,['Himanshu Kaushik'],"https://static.toiimg.com/thumb/msid-62991647,width-1070,height-580,imgsize-1353596,resizemode-6,overlay-toi_sw,pt-32,y_pad-40/photo.jpg","AHMEDABAD: Data released by the National Family Health Survey reveals that the 0.30% of males in the age group of 15-24 were found to be HIV positive. The data reveals that prevalence of HIV in this group was higher than in the 15-49 age group.Combined data for Gujarat, Daman and Dadra Nagar Haveli reveals that 0.19% of men in the age group of 15-49 were HIV positive while the number for women in the same age group was 0.18%. The data further reveals that in the age group of 15-54, the number increased to 0.24%.The officials said that in the 15-24 years group, prevalence was more than any other age group. Interestingly, in this age group, no female was found to be HIV positive. The data also reveals that these are the percentage of HIV positive women and men tested by groups of states or Union territories.The data further reveals that of the 0.48% married couples who are HIV positive only 0.04% were couples where both spouses were HIV positive. The data further revealed that 0.22% men were HIV positive with their wives being HIV negative. Similarly, in 0.22% it was the wife who was HIV positive while the husband was not HIV positive.The survey also brought to light the failure of the government to create awareness about HIV. According to the data released, only 69% of men and 43% of women were aware that use of condoms during sex can prevent HIV. Among men, Gujarat ranked 10 from the bottom when it came to knowledge of condoms and women were the fourth worst, better only than Bihar, Dadra and Nagar Haveli and Nagaland.The data reveals the awareness of mother-to-child transmission (MTCT) of HIV/AIDS was very poor in Gujarat among women, Dadra and Nagar Haveli has the lowest awareness (16%) of MTCT, followed by Bihar (33%) and Gujarat (34%).The data further reveals that only 59% women were aware of HIV, while among 77% men had awareness about HIV. The data further reveals that only 1% of women had high-risk intercourse in 2015-16 while 6.8% of men had high-risk intercourse in same period. Also, only 23.6% women and men knew how to prevent HIV/AIDS and another 20% had comprehensive knowledge. Divyang Oza, the project officer of the AIDS Control Society said that teenage groups are the most affected and the most common mode of infection was sexual transmission. The second strongest mode for HIV transmission is blood transfusion. It also cannot be denied that many couples only use condom for family planning and are unaware that it can be used to prevent HIV. Oza further said that HIV awareness has to be increased, but it is a time-consuming process and while there has been an improvement, it is less than expected.","['reveals', '1524', 'women', 'gujarat', 'group', 'men', 'age', 'prevalent', 'positive', 'awareness', 'data', 'hiv']","AHMEDABAD: Data released by the National Family Health Survey reveals that the 0.30% of males in the age group of 15-24 were found to be HIV positive.
The data reveals that prevalence of HIV in this group was higher than in the 15-49 age group.Combined data for Gujarat, Daman and Dadra Nagar Haveli reveals that 0.19% of men in the age group of 15-49 were HIV positive while the number for women in the same age group was 0.18%.
The data further reveals that in the age group of 15-54, the number increased to 0.24%.The officials said that in the 15-24 years group, prevalence was more than any other age group.
Interestingly, in this age group, no female was found to be HIV positive.
The data also reveals that these are the percentage of HIV positive women and men tested by groups of states or Union territories.The data further reveals that of the 0.48% married couples who are HIV positive only 0.04% were couples where both spouses were HIV positive."
33,26-2-2018,['Faiz Rahman Siddiqui'],"https://static.toiimg.com/thumb/msid-63066271,width-1070,height-580,imgsize-1353596,resizemode-6,overlay-toi_sw,pt-32,y_pad-40/photo.jpg","BANGARMAU ( Unnao ): When it comes to solemnising marriage, majority of people go all out to check for the compatibility of horoscopes or `kundalis' of prospective bride or a groom.But in Prem Ganj, one of the three pockets of Bangarmau town of Unnao district which hogged limelight after detection of alarming number of HIV positive cases, there is something more important than checking for the compatibility of ones horoscope or `kundali':""People, who are coming with proposals here have started insisting to get a 'No HIV' certificates from locals. Majority of locals however have wisely accepted their demand and went for HIV test to avoid hurdles in future,"" confirmed Sunil Kumar, a local corprator.The unusual condition came under spotlight when at least 58 persons were tested HIV positive in three localities of Bangarmau town, including Prem Ganj, Chakmir and Kirmidiyapur, after a quack had allegedly used infected syringes to treat scores of his patients. Muneeshwar (name change), a private worker, hails from the Prem Ganj pocket, one of the same pocket and a bride was chosen for him from Tirwa area of Kannauj district. Their marriage is slated to take place in the upcoming marriage season soon after Holi festival.On Monday last, the parents of the girl, however, told Muneeshwar's parents that they had to abide by certain conditions prior to the wedding to take place in the first week of March.The boy's side agreed and Muneeshwar underwent the necessary medical tests at the private hospital on Friday.""On Saturday, when he got the result, Muneeshwar and his family members heaved a sigh of relief as he had tested negative for HIV,"" informed a relative of Muneeshwar, who had played a role of mediator while talking to TOI and added that he had received a doctor’s certificate, stating that he was not an HIV carrier.When the parents and siblings of the bride were informed about the results, they too were elated and gave their final consent asking Muneeshwars family to come with a `baraat' on March 4.This unusual demand may upset some people in our traditional society who might even call of a marriage, but both the sides are praiseworthy, said Dr I S Gilada, President of AIDS Society of India.""While one side voluntarily adhere to their demands and the other side without fear that their demand may invite trouble, instead exhibited guts and ask groom to undergo HIV screening, both sides are praiseworthy. This way we can ensure better medical compatibility between partners.""Potato grower Deepak (name change), a resident of Kirmidiyapur, another pocket from where several tested HIV positive, whose daughters marriage was being fixed in Asothar area of Unnao was taken aback when he was asked by groom side to produce a certificate that his daughter was HIV-free. ""I took my daughter to VCTC (VoluntaryCounseling and Testing Centre), where she tested negative. I did not want to take any risk since my daughter’s marriage was being finalised,"" Deepak said.""It is a positive approach towards disease. It shows that people are becoming aware of the disease,"" chief medical officer Unnao Dr SP Chaudhary said further.","['kundali', 'prem', 'ups', 'certificate', 'cases', 'pocket', 'important', 'tested', 'positive', 'nagar', 'unnao', 'muneeshwar', 'parents', 'medical', 'marriage', 'matching', 'hiv']","Muneeshwar (name change), a private worker, hails from the Prem Ganj pocket, one of the same pocket and a bride was chosen for him from Tirwa area of Kannauj district.
""I took my daughter to VCTC (VoluntaryCounseling and Testing Centre), where she tested negative.
I did not want to take any risk since my daughter’s marriage was being finalised,"" Deepak said.
""It is a positive approach towards disease.
It shows that people are becoming aware of the disease,"" chief medical officer Unnao Dr SP Chaudhary said further."
34,27-2-2018,['Faiz Rahman Siddiqui'],"https://static.toiimg.com/thumb/msid-63075119,width-1070,height-580,imgsize-1250621,resizemode-6,overlay-toi_sw,pt-32,y_pad-40/photo.jpg","BANGARMAU ( UNNAO ): When it comes to solemnising marriage, most of the people check for the compatibility of horoscopes or 'kundalis' of prospective bride and groom.But in Prem Ganj, one of the three pockets of Bangarmau town of Unnao district which hogged limelight after detection of alarming number of HIV positive cases, there is something more important than checking for the compatibility of one's horoscope or 'kundali'. ""People, who are coming here with marriage proposals have started insisting to get a `No HIV' certificate from locals. Most of the locals however have accepted their demand and went for HIV test to avoid hurdles in future,"" confirmed Sunil Kumar , a local corporator.The unusual condition came under spotlight when at least 58 persons were tested HIV positive in three localities of Bangarmau town, including Prem Ganj, Chakmir and Kirmidiyapur, after a quack had allegedly used infected syringes to treat scores of his patients.Muneeshwar (name changed), a private worker, who hails from Prem Ganj pocket, chose a girl from Tirwa area of Kannauj district. Their marriage is slated to take place soon after the Holi festival.On Monday last, parents of the girl told the boy's parents that they had to abide by certain conditions prior to the wedding.The boy's side agreed and Muneeshwar underwent the necessary medical tests at the private hospital on Friday.""On Saturday, after getting the test report, Muneeshwar and his family members heaved a sigh of relief as he had tested negative for HIV,"" informed a relative of Muneeshwar, who had played a role of mediator while talking to TOI and added that the doctor's report confirmed that he was not an HIV carrier.When the parents and siblings of the bride were informed about the report, they too were elated and gave their final consent asking the boy's family to come with `baraat' on March 4.This unusual demand might upset some people in our traditional society who may even call of a marriage, but both the sides are praiseworthy, said Dr IS Gilada , President, AIDS Society of India.","['prem', 'unusual', 'villages', 'bangarmau', 'matches', 'boys', 'ganj', 'fix', 'horoscope', 'unnao', 'parents', 'muneeshwar', 'marriage', 'report', 'hiv']","BANGARMAU ( UNNAO ): When it comes to solemnising marriage, most of the people check for the compatibility of horoscopes or 'kundalis' of prospective bride and groom.But in Prem Ganj, one of the three pockets of Bangarmau town of Unnao district which hogged limelight after detection of alarming number of HIV positive cases, there is something more important than checking for the compatibility of one's horoscope or 'kundali'.
""People, who are coming here with marriage proposals have started insisting to get a `No HIV' certificate from locals.
Most of the locals however have accepted their demand and went for HIV test to avoid hurdles in future,"" confirmed Sunil Kumar , a local corporator.The unusual condition came under spotlight when at least 58 persons were tested HIV positive in three localities of Bangarmau town, including Prem Ganj, Chakmir and Kirmidiyapur, after a quack had allegedly used infected syringes to treat scores of his patients.Muneeshwar (name changed), a private worker, who hails from Prem Ganj pocket, chose a girl from Tirwa area of Kannauj district.
Their marriage is slated to take place soon after the Holi festival.On Monday last, parents of the girl told the boy's parents that they had to abide by certain conditions prior to the wedding.The boy's side agreed and Muneeshwar underwent the necessary medical tests at the private hospital on Friday.
""On Saturday, after getting the test report, Muneeshwar and his family members heaved a sigh of relief as he had tested negative for HIV,"" informed a relative of Muneeshwar, who had played a role of mediator while talking to TOI and added that the doctor's report confirmed that he was not an HIV carrier.When the parents and siblings of the bride were informed about the report, they too were elated and gave their final consent asking the boy's family to come with `baraat' on March 4.This unusual demand might upset some people in our traditional society who may even call of a marriage, but both the sides are praiseworthy, said Dr IS Gilada , President, AIDS Society of India."
35,6-3-2018,['Tamaghna Banerjee'],"https://static.toiimg.com/thumb/msid-63163185,width-1070,height-580,imgsize-125786,resizemode-6,overlay-toi_sw,pt-32,y_pad-40/photo.jpg","KOLKATA: They are a bunch of 10 ordinary teenagers, who nourish the dream of making it big. But their HIV-positive status has turned them into social pariahs, with the city offering them no space to pursue their entrepreneurial dreams.Out to open their own café called “Cafe Positive”, all they have met with for the last three months is a big negative. No house-owner in some of south Kolkata’s posh localities has been willing to rent out space once told about “who will manage and run the shop”.While a few landlords have straightaway refused saying “e paray erom cholbena (such business won’t run in this neighbourhood)”, others have been courteous enough with financial help and old clothes, but pleaded helplessness in renting out space to the 18-plus teens.The NGO funding the café and trying to find a 750sqft space has approached over a dozen owners since December at locations like Golpark, Dover Lane, Lake Road , Hindustan Park and Purna Das Road. “We have been looking for a suitable space for the café since December and approached a number of house-owners directly and through brokers. The owners initially seemed excited at the concept, but the moment they learnt that the shop will be managed and run solely by HIV-positive children, they backed out,” said Kallol Ghosh , founder of Anandaghar, a shelter for abandoned HIV/AIDS-infected children.TOI spoke to two house-owners, one at Lake Road and the other at Dover Lane. “I would not mind renting out space to them. But we live in a joint family and some members have objections. I could not convince them, so I rejected the offer,” said a landlady.The house-owner at Dover Lane, too, blamed her neighbours and family. “I don’t know how people in our neighbourhood would react to it. I know there are many misconceptions associated with HIV . I don’t think I am in a position to convince everyone. Moreover, I have now decided to rent the space to a boutique and not an eatery,” he said.The Human Immunodeficiency Virus and Acquired Immune Deficiency Syndrome (Prevention and Control) Bill, 2017 defines what can count as discrimination against HIV-positive people. It lists that denial or discontinuation of employment, education, healthcare services, renting or residing property, standing for public or private office will count as discrimination along with unfair treatment in any of the above mentioned categories.The shelter at Narendrapur is home to around 70-odd young patients and this café project is part of an initiative to make a group self-sufficient. The NGO will give the initial funds and later hand over the management of the café to the 10 boys and girls, who would be running it.“We have been undergoing training at this shelter and can’t wait to start our café. We know the disease we suffer from and how it spreads or what precautions we need to take. But strangely, the adults don’t understand that HIV doesn’t spread through touch and often hesitate to even shake hands with us,” said Susanta Pal (name changed), a Class XII student who was diagnosed with HIV when he was just 5.“HIV does not spread by kissing, hugging, sharing food/drink, toilet seats, sweat, touching, sneeze/cough or through insect bites. We also want society to know about these from our café. But for that, we first need an opportunity,” said Sathi Biswas (name changed), another Class XII student who specialises in sandwich-making and baking cookies.According to the plan, food and beverages at the 750sqft ground-floor café will be served on disposable plates and there will be no sharp cutleries or glass items that can cause bleeding. “We are not looking for any exceptions or rebate and are ready to pay as per the existing market rate but even then not a single house-owner is ready,” lamented Ghosh.","['space', 'lane', 'dream', 'house', 'hits', 'café', 'shelter', 'road', 'run', 'kolkata', 'hurdle', 'know', 'renting', 'houseowner', 'hivpositive', 'hiv']","KOLKATA: They are a bunch of 10 ordinary teenagers, who nourish the dream of making it big.
“We have been looking for a suitable space for the café since December and approached a number of house-owners directly and through brokers.
“I would not mind renting out space to them.
I could not convince them, so I rejected the offer,” said a landlady.The house-owner at Dover Lane, too, blamed her neighbours and family.
We know the disease we suffer from and how it spreads or what precautions we need to take."
36,9-3-2018,[],"https://static.toiimg.com/thumb/msid-63208705,width-1070,height-580,imgsize-188835,resizemode-6,overlay-toi_sw,pt-32,y_pad-40/photo.jpg","SURAT: Her life had many twists and turns as she had to pass from the toughest struggle for inclusion and acceptance after facing discrimination in society when she was detected with HIV in 1997.At the age of 21 years, she and her husband had to take a tough decision to abort the child. With a mission to change peoples’ perception about HIV/AIDS, she got herself involved in social activities for HIV community. At present, she is the face of HIV community in the country.Meet Daxa Patel , who is not only president of National Coalition of People Living with HIV in India (NCPI+), but also relentlessly working for patients, most of them outcast by the society. From organizing awareness camps to marriage fairs for HIV patients and successfully running a day-boarding school and hostel for HIV-infected children, Daxa has put her life, blood and sweat for their uplift.“When my husband and I were diagnosed with HIV in 1997, there was no treatment available. Meanwhile, I got pregnant and had no choice but to go for termination. One of the doctors told me that my lifespan was just for five months. I was searching for a person infected with HIV and I found a woman who was living with the disease for two years. This gave me confidence that I could also live long. This was the turning point in my life,” says 42-year-old Daxa.Daxa, who was doing a small embroidery business from her house, and her husband informed their family and relatives about the disease. To their surprise, the family was very supportive and this further boosted her confidence on fighting discrimination faced by people like her. Her treatment began only in 2007, 10 years after he was infected.It was in 2003, Daxa, who was earlier working as a counsellor with a city-based non-governmental organization SAHAS, got in touch with Umesh Patel. Along with Umesh and other few community members, they decided to launch a platform for HIV positive people. This is how the Gujarat State Network for People Living with HIV/ÁID (GSNP+) was launched in 2003.The main objective of GSNP+ was to assist the people infected with HIV/AIDS, ensure they get proper medical attention and timely medicines and organizing awareness programmes etc.“We used to meet the HIV patients at some deserted places and gardens to protect their identity. We started with just 35 members at GSNP+ and now we have 67,000 members across all the districts in Gujarat,” she said.Later, the NCPI+ was launched at the national level and the organization has a presence in 32 states across the country. Daxa is also running Janani Dham for the destitute HIV and AIDS infected orphaned children on the outskirts of the city since 2009. It is supported by Gujarat government’s social justice department and Surat-based P P Savani Group and has around 98 boys and girls.GSNP+ will soon launch a scheme for HIV positive people, where they can get easy medicine refill and won’t have to visit government dispensaries. This is for the first time that a project has been launched with the state government and will be introduced on national-level.","['woman', 'spreading', 'members', 'hiv', 'husband', 'international', 'gujarat', '2018', 'patients', 'whos', 'living', 'life', 'positivity', 'launched', 'day', 'infected', 'daxa', 'womens']","With a mission to change peoples’ perception about HIV/AIDS, she got herself involved in social activities for HIV community.
I was searching for a person infected with HIV and I found a woman who was living with the disease for two years.
Along with Umesh and other few community members, they decided to launch a platform for HIV positive people.
Daxa is also running Janani Dham for the destitute HIV and AIDS infected orphaned children on the outskirts of the city since 2009.
This is for the first time that a project has been launched with the state government and will be introduced on national-level."
